{"contract":1,"domains":[{"accepted":0,"cards":0,"id":"security","name":"security","partial":false,"score":{"src":"model.score areas.security","value":1.0}},{"accepted":0,"cards":0,"id":"structure","name":"structure","partial":false,"score":{"src":"model.score areas.structure","value":1.0}},{"accepted":0,"cards":3,"id":"quality","name":"quality","partial":false,"score":{"src":"model.score areas.quality","value":0.87}},{"accepted":0,"cards":0,"id":"performance","name":"performance","partial":false,"score":{"src":"model.score areas.performance","value":null}},{"accepted":0,"cards":0,"id":"ux","name":"ux","partial":false,"score":{"src":"model.score areas.ux","value":null}},{"accepted":0,"cards":0,"id":"maintainability","name":"maintainability","partial":false,"score":{"src":"model.score areas.maintainability","value":1.0}}],"formula":"area = 100 x 20 / (20 + weighted points per 100 files); score = mean of measured areas","history":[{"at":"2026-10-31T10:40:16+00:00","commit":"b4a70c4377f6dd28e8d4d1d7965206a1653055a0","score":0.97}],"schema_version":1,"score":{"src":"model.score: mean of measured areas, capped at 39 by a confirmed critical problem","value":0.97},"unchecked":[]}